{
  "validation_id": "VAL-HB-R0-001",
  "heartbeat_id": "HB-R0-001",
  "timestamp_utc": "2026-05-21T00:09:22.818920+00:00",
  "gates": [
    {
      "gate_id": 1,
      "gate_name": "preconditions_exist",
      "result": "PASS",
      "evidence": "10 preconditions verified (min 5)"
    },
    {
      "gate_id": 2,
      "gate_name": "one_shot_only",
      "result": "PASS",
      "evidence": "No daemon/cron/scheduler code patterns in executable lines"
    },
    {
      "gate_id": 3,
      "gate_name": "no_network",
      "result": "PASS",
      "evidence": "No network imports in script"
    },
    {
      "gate_id": 4,
      "gate_name": "no_secrets",
      "result": "PASS",
      "evidence": "No secret/env access code in executable lines"
    },
    {
      "gate_id": 5,
      "gate_name": "state_fabric_append_only",
      "result": "PASS",
      "evidence": "3 events appended, sequential IDs [2, 3, 4], all from heartbeat_r0"
    },
    {
      "gate_id": 6,
      "gate_name": "decision_table_applied",
      "result": "PASS",
      "evidence": "Decision='REQUEST_T1', valid=True, reason_len=128, rule='Rule 2: T1 Pending Check'"
    },
    {
      "gate_id": 7,
      "gate_name": "no_action_is_valid",
      "result": "PASS",
      "evidence": "Decision='REQUEST_T1', actions_taken=[] (expected empty)"
    },
    {
      "gate_id": 8,
      "gate_name": "no_autonomy_creep",
      "result": "PASS",
      "evidence": "All 9 hard-blocked actions listed in actions_not_taken"
    },
    {
      "gate_id": 9,
      "gate_name": "no_runtime_activation",
      "result": "PASS",
      "evidence": "No .cron/.service/.pid files found (cron=0, pid=0)"
    },
    {
      "gate_id": 10,
      "gate_name": "unified_face_single_voice",
      "result": "PASS",
      "evidence": "Summary has all 5+ required sections"
    },
    {
      "gate_id": 11,
      "gate_name": "t1_pending_preserved",
      "result": "PASS",
      "evidence": "6 T1 decisions preserved (not usurped)"
    },
    {
      "gate_id": 12,
      "gate_name": "no_canon_no_appvision_no_preia",
      "result": "PASS",
      "evidence": "No doctrine/canon mutations (doctrine=0, canon=0)"
    }
  ],
  "total_pass": 12,
  "total_fail": 0,
  "verdict": "PASS"
}